[
  {
    "id": "SAA_FOLDER_MAP_DRIFT-drift-root-directories-not-documented-in-folder-map-md",
    "agent": "SAA_FOLDER_MAP_DRIFT",
    "severity": "MAJOR",
    "category": "drift",
    "title": "Root directories not documented in FOLDER_MAP.md",
    "description": "Root directories exist that are not listed in the folder map.",
    "affected_paths": [
      "00_SYSTEM/",
      "01_DOCTRINE/",
      "02_PLAYBOOKS/",
      "03_TEMPLATES/",
      "04_INITIATIVES/",
      "05_MATTERS/",
      "06_RUNS/",
      "07_REFERENCE/",
      "08_RESEARCH/",
      "09_INBOX/",
      "10_ARCHIVE/",
      "scripts/"
    ],
    "suggested_fix": "Update FOLDER_MAP.md or relocate these directories into documented locations.",
    "created_at": "2026-02-18T04:15:36+00:00"
  }
]